{
  "schema_version": "3.0",
  "level": "n2",
  "level_display": "N2",
  "dataset_version": "fixture",
  "selection_version": "1",
  "slot": {
    "index": 0,
    "seconds": 600,
    "count": 4096
  },
  "sequence": {
    "position": 42,
    "pool": 650
  },
  "word": {
    "id": "demo:デモンストレーション",
    "surface": "デモンストレーション",
    "reading": "デモンストレーション",
    "ruby_segments": [
      {
        "base": "デモンストレーション",
        "reading": null
      }
    ],
    "display_gloss": "demonstration",
    "example": {
      "ja": "彼らは新製品のデモンストレーションを行った。",
      "en": "They gave a demonstration of the new product."
    },
    "display": {
      "word_size": "xlong",
      "example_size": "compact"
    },
    "level": "N2"
  }
}
