{
  "schema_version": "3.0",
  "level": "n2",
  "level_display": "N2",
  "dataset_version": "fixture",
  "selection_version": "1",
  "slot": {
    "index": 0,
    "seconds": 600,
    "count": 4096
  },
  "sequence": {
    "position": 42,
    "pool": 650
  },
  "word": {
    "id": "demo:申し込む",
    "surface": "申し込む",
    "reading": "もうしこむ",
    "ruby_segments": [
      {
        "base": "申",
        "reading": "もう"
      },
      {
        "base": "し",
        "reading": null
      },
      {
        "base": "込",
        "reading": "こ"
      },
      {
        "base": "む",
        "reading": null
      }
    ],
    "display_gloss": "to apply for, to make an application, to propose",
    "example": {
      "ja": "来週の試験に申し込みました。",
      "en": "I applied for next week's examination."
    },
    "display": {
      "word_size": "medium",
      "example_size": "normal"
    },
    "level": "N2"
  }
}
