{
  "schema_version": "3.0",
  "level": "n5",
  "level_display": "N5",
  "dataset_version": "fixture",
  "selection_version": "1",
  "slot": {
    "index": 0,
    "seconds": 600,
    "count": 4096
  },
  "sequence": {
    "position": 42,
    "pool": 650
  },
  "word": {
    "id": "demo:本",
    "surface": "本",
    "reading": "ほん",
    "ruby_segments": [
      {
        "base": "本",
        "reading": "ほん"
      }
    ],
    "display_gloss": "book",
    "example": {
      "ja": "図書館で本を借りました。",
      "en": "I borrowed a book from the library."
    },
    "display": {
      "word_size": "short",
      "example_size": "normal"
    },
    "level": "N5"
  }
}
