{
  "schema_version": "3.0",
  "level": "n1",
  "level_display": "N1",
  "dataset_version": "fixture",
  "selection_version": "1",
  "slot": {
    "index": 0,
    "seconds": 600,
    "count": 4096
  },
  "sequence": {
    "position": 42,
    "pool": 650
  },
  "word": {
    "id": "demo:勧告",
    "surface": "勧告",
    "reading": "かんこく",
    "ruby_segments": [
      {
        "base": "勧",
        "reading": "かん"
      },
      {
        "base": "告",
        "reading": "こく"
      }
    ],
    "display_gloss": "advice",
    "display": {
      "word_size": "short",
      "example_size": "normal"
    },
    "level": "N1"
  }
}
