{
  "schema_version": "3.0",
  "level": "n3",
  "level_display": "N3",
  "dataset_version": "fixture",
  "selection_version": "1",
  "slot": {
    "index": 0,
    "seconds": 600,
    "count": 4096
  },
  "sequence": {
    "position": 1840,
    "pool": 3054
  },
  "word": {
    "id": "demo:hirou",
    "surface": "拾う",
    "reading": "ひろう",
    "ruby_segments": [
      {
        "base": "拾",
        "reading": "ひろ"
      },
      {
        "base": "う",
        "reading": null
      }
    ],
    "display_gloss": "to pick up",
    "level": "N4",
    "example": {
      "ja": "床からペンを拾って下さい。",
      "en": "Please pick up the pen from the floor."
    },
    "display": {
      "word_size": "short",
      "example_size": "normal"
    }
  }
}
